target,source
i'm supposed to have a refund but it isn't there,Refund_not_showing_up _ i'm | there | have | isn't | to | refund | a
my refund is not here yet,Refund_not_showing_up _ yet | here | not | refund
i've been waiting for a refund to show up and i don't see it on my statement yet.,Refund_not_showing_up _ i | to | yet. | up | refund | for | waiting | i've | my | and | show | see
a refund for a recent return has not arrived on my card.,Refund_not_showing_up _ a | recent | arrived | my | not | on | return | has
where is my refund? it appears to be missing.,Refund_not_showing_up _ refund? | to | missing. | it | appears | where
what do i need to do for the card activation?,activate_my_card _ the | activation? | for | i | do | need | what
i have a new card and need to activate it,activate_my_card _ and | i | it | to | need | a | card
how do i turn on my new card?,activate_my_card _ turn | new | i | on | do
it won't let me activate my card.,activate_my_card _ let | won't | me | card.
my card is not able to be activated how do i get it to work?,activate_my_card _ to | be | card | able | it | get | is | not | work? | i
what are age requirements for opening an account?,age_limit _ for | account? | requirements | what | opening
how old can one use your service?,age_limit _ use | service? | old | how
my son has just turned 13 is he old enough for an account?,age_limit _ an | son | 13 | just | my | account? | enough | turned | for
my daughter needs an acount.,age_limit _ daughter | my | needs
as my kids get older are they able to get set up with their own accounts?,age_limit _ they | accounts? | up | their | set | with | able | are | to | own | kids
why isn't my google pay top up working?,apple_pay_or_google_pay _ working? | my | why | up | isn't
how can i top up with google play?,apple_pay_or_google_pay _ how | up | google | top | i
is there a way to top up using my apple watch?,apple_pay_or_google_pay _ apple | to | up | watch? | a | top | using
google pay top up isn't working,apple_pay_or_google_pay _ up | pay | working | google
can i pay for my gas using my apple watch?,apple_pay_or_google_pay _ my | watch? | apple | my | for | i | pay
where can i withdraw money from?,atm_support _ withdraw | where | i | money
which atms accept this bill of fare ?,atm_support _ ? | fare | this | accept | which
tell me what atms take this card.,atm_support _ card. | atms | what | me
tell me what atms use this card.,atm_support _ what | card. | tell | me
can i use my card to withdraw from my account?,atm_support _ card | i | withdraw | my | can | use | from
auto-top up option can be found where?,automatic_top_up _ found | can | auto-top | option
can i automatically top-up when traveling?,automatic_top_up _ i | traveling? | when | automatically
is there a auto top-up option?,automatic_top_up _ top-up | auto | option? | a
is there a limit to auto top?,automatic_top_up _ limit | top? | to | auto
how low does the balance have to be before the system updates?,automatic_top_up _ be | low | the | updates? | have | balance | the | system
i completed a transfer that isn't showing up on my account.,balance_not_updated_after_bank_transfer _ showing | account. | i | that | on | a | up
it is common for an international transfer to take 2 days or longer? i made a transfer from france 2 days ago and i have not seen it yet.,balance_not_updated_after_bank_transfer _ 2 | take | i | have | an | and | days | is | from | ago | i | or | a | it | it | france | international | not | longer? | transfer
i made a bank transfer from my uk account today but it's not showing.  can you check status?,balance_not_updated_after_bank_transfer _ not | you | my | today | made | from | status? | can | i | uk | transfer | account | a
what amount of time does it take for a transfer to reflect and be available,balance_not_updated_after_bank_transfer _ for | take | transfer | of | and | reflect | be | a | available | amount
i've transferred money into my account but the balance is the same,balance_not_updated_after_bank_transfer _ money | account | transferred | the | into | the | i've | balance
my balance doesn't show my deposit.,balance_not_updated_after_cheque_or_cash_deposit _ my | show | deposit. | my
where is my missing cheque i deposited?,balance_not_updated_after_cheque_or_cash_deposit _ my | where | missing | is
i have yet to receive the cash i added to my account this morning.,balance_not_updated_after_cheque_or_cash_deposit _ receive | yet | this | to | morning. | my | cash | account | have
why hasn't my account updated?,balance_not_updated_after_cheque_or_cash_deposit _ updated? | account | my
i need my account checked because it appears there is a problem. i attempted to update my balance yesterday using cheque but it doesn't seem to have worked.  should this not be faster than this?,balance_not_updated_after_cheque_or_cash_deposit _ it | attempted | but | appears | yesterday | should | i | there |  | is | seem | my | this | using | not | update | this? | problem. | to | need | checked | cheque | than | balance | it
my transfer to a beneficiary was rejected.,beneficiary_not_allowed _ rejected. | transfer | was | to
my beneficiary didn't receive my transfer,beneficiary_not_allowed _ receive | didn't | transfer | my
i'm trying to purchase crypto via the app. i haven't been able to get it to go through. am i doing something wrong?,beneficiary_not_allowed _ trying | the | to | i | i | been | via | go | app. | doing | am | able | wrong? | to | haven't | to
why is my beneficiary not being allowed to get payment services?,beneficiary_not_allowed _ services? | is | beneficiary | to | not | my | get
why was i denied the option to transfer money to a selected beneficiary?,beneficiary_not_allowed _ why | to | i | beneficiary? | denied | a | selected | option | was
cancelling a transaction,cancel_transfer _ transaction | cancelling
my morning transaction needs to be canceled.,cancel_transfer _ canceled. | be | morning | transaction
i made a mistake this morning when i did a transfer. how do i reverse it?,cancel_transfer _ i | this | a | reverse | did | i | a | do | it? | morning | made
a payment i made is for a wrong amount can you help me correct the mistake.,cancel_transfer _ wrong | a | mistake. | amount | me | you | payment | a | is | correct | i
i want to revert this mornings transaction.,cancel_transfer _ want | to | mornings | transaction.
i need a new card my old card is expiring.,card_about_to_expire _ new | card | my | i | old | a | expiring.
how do i get a new expiration date?,card_about_to_expire _ do | new | how | get | date?
is it possible to get a new card in china?,card_about_to_expire _ in | to | it | china? | card | new | is
my card is about to expire.  where do i get a new one.,card_about_to_expire _ new | expire. | about | my |  | is | card | one. | do
what do i do after my card expires?,card_about_to_expire _ i | card | do | expires? | my
where do i pay with my debit or credit card?,card_acceptance _ or | debit | with | do | my | where | card?
which establishments will accept my card?,card_acceptance _ accept | card? | establishments | will
where can i use my card to pay?,card_acceptance _ i | pay? | my | can | where
where can my card be used?,card_acceptance _ be | can | card | my
where is this card accepted?,card_acceptance _ card | is | where
what is the expected delivery date of my card?,card_arrival _ is | delivery | card? | the | what | date
how can i track my card's delivery?,card_arrival _ delivery? | my | how | track
is there a reason my new card hasn't arrived?,card_arrival _ hasn't | a | card | new | arrived? | my
why have i not gotten my new card?,card_arrival _ have | new | why | i | gotten
i know i'm getting a new card but would like know when i can expect to receive it.,card_arrival _ getting | it. | like | to | i | know | when | new | can | card | receive | a
how long does it take for a card to arrive?,card_delivery_estimate _ take | long | how | it | a | for | card
how long will it take to get to the us?,card_delivery_estimate _ to | long | how | take | it | to | us?
when can i expect my new card to get here?,card_delivery_estimate _ card | i | to | here? | when | get | new
what is the length of time for one of these items to come to the u.s?,card_delivery_estimate _ these | for | of | of | the | time | the | items | to | come | to
can the delivery be specific to my needs?,card_delivery_estimate _ specific | can | my | be | to
how do i get the card linked,card_linking _ get | linked | how | do
how do i link the new card?,card_linking _ link | new | the | do
how do i reactivate a card i thought i lost?,card_linking _ do | a | thought | lost? | card | i | reactivate
i found my card that i thought i had lost i need to reactive it please help.,card_linking _ thought | i | lost | that | help. | found | i | to | need | i | i
where do i go to get my new card linked?,card_linking _ my | go | i | card | get | linked? | to
what is the main reason of this problem,card_not_working _ problem | of | reason | what | this
i am unable to use my card.,card_not_working _ to | i | am | card.
the card that i have isn't working. this is the physical card.,card_not_working _ this | isn't | is | the | i | card | card. | that
i can't use my card because it is not working.,card_not_working _ it | not | card | use | because | my | can't
i don't know what's wrong with my card but it has not worked at multiple places today.,card_not_working _ wrong | places | but | today. | know | worked | with | multiple | i | not | don't
please explain the extra fee when i paid with the card.,card_payment_fee_charged _ with | please | paid | explain | card. | when | i
i was charged an extra fee for a card payment. i was unaware of these fees beforehand.,card_payment_fee_charged _ beforehand. | fee | a | card | fees | payment. | these | was | charged | an | i
why was the price higher when i paid with my card?,card_payment_fee_charged _ why | was | when | with | card? | higher | paid
i have a fee and i don't know why,card_payment_fee_charged _ i | know | don't | fee | i | why
i paid with card and was charged a fee that shouldn't be there!,card_payment_fee_charged _ shouldn't | card | with | and | be | paid | there! | fee | that
i'm worried that my card has been compromised because i see a payment that i didn't make.,card_payment_not_recognised _ compromised | i | because | has | didn't | i | payment | worried | that | a | card
someone else accessed my account and made a payment.,card_payment_not_recognised _ else | a | payment. | someone | made | account
i just saw some charges on my card from the past days that i dont recognize i need to freeze the card asap! will i be able to get my money back?,card_payment_not_recognised _ need | days | card | to | recognize | the | get | just | some | dont | from | i | to | card | on | saw | will | the | money | i | able | be
i have a card payment that i don't recognize. what should i do?,card_payment_not_recognised _ i | what | recognize. | should | a | have | that | card | i
i think that there is a payment on my card that i did not authorize.  i don't recognize the name attached to the transaction.,card_payment_not_recognised _ the | to | don't | i | that | a | authorize. | is | on | not | the | that | transaction. | there | did | name | attached
it looks like the exchange rates on my card payment are wrong,card_payment_wrong_exchange_rate _ are | exchange | it | rates | card | wrong | the | like
something is wrong with my exchange rate charge,card_payment_wrong_exchange_rate _ exchange | my | with | something | charge
i bought an item and the exchange rate was wrong.,card_payment_wrong_exchange_rate _ the | was | item | and | bought | an | rate
your exchange rate was off.  i was charged extra on my payment that i made last saturday.,card_payment_wrong_exchange_rate _ off. | was | i | was | rate | saturday. | on | last | payment |  | your | made
the exchange rate was incorrect for this item i bought.,card_payment_wrong_exchange_rate _ rate | this | item | for | was | the | incorrect
my card is stuck in the atm?,card_swallowed _ in | atm? | the | card
my card is stuck inside the atm what am i supposed to do?,card_swallowed _ inside | atm | the | stuck | what | i | do? | am | is
an atm machine didn't give me back my card.,card_swallowed _ me | machine | atm | didn't | back | give
i didn't get my card back from the atm.,card_swallowed _ back | from | the | get | card | i
the atm sucked my card in.,card_swallowed _ atm | the | in. | my
why did they take more money out then i withdrawed?,cash_withdrawal_charge _ take | withdrawed? | they | why | money | more | did
why are you charging for cash withdrawals? i went to withdraw some money earlier today after getting my groceries and it appears there is a fee that wasn't there before,cash_withdrawal_charge _ you | it | charging | is | cash | to | wasn't | i | some | after | there | today | withdrawals? | appears | withdraw | earlier | that | went | for | why | getting
is there an extra fee for using an atm?,cash_withdrawal_charge _ fee | an | atm? | using | an | for
why am i being charged for withdrawing cash but haven't in the past?,cash_withdrawal_charge _ but | withdrawing | for | why | i | charged | cash | haven't | past?
do cash withdrawals cost anything?,cash_withdrawal_charge _ cash | anything? | do
the app says i made a cash withdrawal that i didn't make,cash_withdrawal_not_recognised _ the | didn't | withdrawal | make | app | a | that | i
please help me its urgent. someone has withdrawn money from my account as few hours before my wallet has been. now i want to stop withdrawal of more money.,cash_withdrawal_not_recognised _ me | from | i | more | hours | has | help | money. | been. | has | to | withdrawn | money | please | now | of | my | few | as | its
how do i report a cash withdrawal that wasn't me?,cash_withdrawal_not_recognised _ report | that | me? | how | do | withdrawal | a
a wd was just made on my account but it was not me and i still have my card.  what to do?,cash_withdrawal_not_recognised _ still | to | not | wd | it | on | just | me | what | account | my | was | was |  | do? | my
somebody made a withdrawal from my account for 500. i have my card so how can this be? does somebody have a duplicate card or something? help please.,cash_withdrawal_not_recognised _ my | 500. | can | have | a | so | or | please. | card | withdrawal | somebody | does | have | this | a | card | be? | how | from
do you know how to change my card pin?,change_pin _ you | do | how | card | my | to
can i change my pin?,change_pin _ can | change | i
can you tell me what i need to do to have my pin changed?,change_pin _ my | you | what | can | changed? | need | do | i | tell
can i change my pin on my phone?,change_pin _ pin | can | phone? | change | my
do i need to speak to a representative to change my pin?,change_pin _ speak | need | pin? | my | representative | to | to | to
i noticed my card was used in a small town that i have never been to. can you stop the card from being used more?,compromised_card _ i | being | been | never | noticed | used | used | small | the | stop | card | more? | that | town | have | a | was
i believe that someone is using my card without my knowledge!,compromised_card _ i | is | my | knowledge! | card | that | without
how do i report possible fraudulent activity on my account?,compromised_card _ activity | on | fraudulent | my | possible | do | account?
my card must have used my card as there are some transactions that i haven't done myself..,compromised_card _ transactions | there | that | card | haven't | must | as | some | card | used | done
someone has been using my card. there are unfamiliar transactions on there. can you freeze the card to keep this from happening?,compromised_card _ has | using | my | happening? | are | the | there. | on | someone | card | you | from | freeze | transactions | keep
i've tried using my contactless in several locations today and it's not working anywhere. it seemed fine before. how do i get it to work again?,contactless_not_working _ do | seemed | my | tried | working | again? | before. | it | it's | locations | and | fine | how | work | to | using | in | not
help me to set up contactless payments.,contactless_not_working _ up | to | help | me
how can i fix my contactless?,contactless_not_working _ contactless? | how | my | can
any charges applicable for new card?,contactless_not_working _ any | new | for | charges
i was trying to use contactless earlier but it didn't work.,contactless_not_working _ didn't | trying | was | contactless | to | use | it
you provide support in what countries?,country_support _ what | support | in | you
you operate in which countries?,country_support _ which | in | countries?
can i get a card that works in other countries like africa and indonesia?,country_support _ get | that | africa | indonesia? | countries | can | in | other | and
is this card available to united states residents?,country_support _ residents? | this | card | to | available
which countries do you support?,country_support _ you | countries | support?
can you tell me why my card payment did not work?,declined_card_payment _ you | work? | tell | card | payment | my | not
i had a card payment that was declined.  why?,declined_card_payment _  | why? | payment | had | was | a | i
can you tell me why my card keeps getting declined every time i try to use it?,declined_card_payment _ every | can | me | my | i | it? | why | try | declined | card | use
why is it saying my card payment is declined when i made it?,declined_card_payment _ i | when | it? | saying | why | is | made | card | is
why do you keep declining my payment?i tried several times with this card and it is just not working.,declined_card_payment _ my | with | you | it | this | card | times | payment?i | do | is | tried | declining | several
i could not get the atm to work,declined_cash_withdrawal _ work | to | the | could | i
i think i am having an issue with withdraws on my card. it was declined on the way to work this morning. this hasn't happened in the past.,declined_cash_withdrawal _ was | i | morning. | withdraws | on | way | think | this | in | past. | the | happened | the | with | to | i | an | work | this
i tried to withdraw cash from the atm machine and it did not work. can you tell me why?,declined_cash_withdrawal _ the | not | and | work. | machine | can | it | from | you | i | did | withdraw | tried
the atm machines keep declining my card and i don't know why. i thought i had money in my account. why is this happening?,declined_cash_withdrawal _ keep | declining | and | don't | money | thought | in | i | my | my | this | had | the | machines | card | happening?
is there something wrong with the atm? it would not let me pull cash out of my account.,declined_cash_withdrawal _ it | the | pull | cash | atm? | something | out | me | with | my | not | account.
transfer unable to be completed states 'declined',declined_transfer _ be | 'declined' | to | completed
why was one of my transfers declined?,declined_transfer _ declined? | was | transfers | one
what would be a reason my transfer got declined?,declined_transfer _ what | declined? | would | be | transfer | reason
i have a transfer that was declined.,declined_transfer _ that | was | transfer | declined.
can you tell me why my transfer declined?,declined_transfer _ my | declined? | transfer | can | me
i need to cancel a transaction on my debit card.,direct_debit_payment_not_recognised _ to | cancel | my | need | transaction | a | i
i need a refund on a direct debit that shows in the app because i did not make it.,direct_debit_payment_not_recognised _ refund | debit | in | shows | not | it. | the | make | because | direct | a | app | i
my statement shows a strange direct debit.,direct_debit_payment_not_recognised _ direct | debit. | strange | shows
i just noticed that i supposedly made a payment to a seller a while back. the problem is i don't recognize the seller. there must be a way to see who it is or track the payment. can you do that because i don't remember this transaction?,direct_debit_payment_not_recognised _ or | made | a | a | to | a | the | because | payment | to | back. | you | there | recognize | supposedly | this | that | see | i | is | problem | that | just | while | i | is | can | transaction? | i | remember | the | don't
there is a payment showing on my app that i didn't do. will you please cancel this payment and refund my money ?,direct_debit_payment_not_recognised _ is | cancel | didn't | and | payment | do. | payment | there | please | my | ? | showing | my | refund | app | on
how many transactions can i make on my disposable card?,disposable_card_limits _ card? | make | my | i | can | on | disposable
am i limited on the amount of disposable cards i can possess?,disposable_card_limits _ possess? | am | of | i | amount | limited | the | on
what are the disposable virtual card limits?,disposable_card_limits _ disposable | the | virtual | what
i need multiple cards per day and they all have to be disposable.,disposable_card_limits _ disposable. | day | to | have | multiple | all | they | and | per
is there a limit to the number of disposable cards per day?,disposable_card_limits _ a | cards | per | the | to | disposable | day? | there
how to edit personal details?,edit_personal_details _ personal | to | details?
i've just moved and i need to change my details,edit_personal_details _ i've | change | moved | i | and | to | my
please tell me where i can update my details since i moved.,edit_personal_details _ me | please | i | details | moved. | can | update | where
my address is incorrect on my file.,edit_personal_details _ my | on | incorrect | address
need my details changed,edit_personal_details _ need | changed
what is the fee for a foreign currency exchange?,exchange_charge _ what | currency | exchange? | the | for | foreign
will i have to pay extra to exchange money?,exchange_charge _ to | exchange | have | extra | pay | money?
what is the rate for exchange fees?,exchange_charge _ the | exchange | rate | for
when exchanging currencies is there an extra fee?,exchange_charge _ exchanging | fee? | is | there | currencies
can you tell me what the exchange fee is?,exchange_charge _ can | what | fee | tell | me | is?
how will i know what the exchange rate is?,exchange_rate _ what | i | exchange | the | how | is?
how do you decide what your exchange rates are?,exchange_rate _ your | do | how | you | what | exchange
how do you calculate exchange rates?,exchange_rate _ exchange | you | how | rates?
i need to know about exchange rates,exchange_rate _ i | exchange | know | rates
what is the exchange looking like?,exchange_rate _ exchange | the | is | looking
i need australian dollars instead of uk currency.,exchange_via_app _ currency. | uk | instead | need | dollars
can i add a new currency to my account?,exchange_via_app _ can | to | currency | account? | i | new
how do i exchange currencies using the app?,exchange_via_app _ how | do | exchange | using | i
i do not need gbp i need aud how do i convert it?,exchange_via_app _ i | i | aud | convert | i | need | it? | do | do
can i exchange currencies with the app?,exchange_via_app _ with | i | the | currencies
my statement shows an extra fee - what is it?,extra_charge_on_statement _ is | fee | what | statement | my | extra | shows
it appears i have a fee in my statement.,extra_charge_on_statement _ appears | statement. | a | it | have | fee
can you tell me about why the account i have was charged an extra 1$,extra_charge_on_statement _ the | tell | account | i | you | was | why | an | have | can
why is there a 1 euro fee on my statement?,extra_charge_on_statement _ fee | a | on | 1 | is | my | euro
i got billed an extra pound!,extra_charge_on_statement _ an | extra | got | billed
my transfer didn't work! help!,failed_transfer _ work! | my | help!
did  my transfer fail?,failed_transfer _ did | my | transfer
can you please assist me in completing a transfer? i'm trying and i keep getting an error. i'm trying to purchase a flat and pay the initial mortgage payment. all i keep getting is an error. can you find out what's happening here?,failed_transfer _ all | completing | is | i'm | transfer? | an | keep | a | error. | an | i'm | flat | happening | what's | please | error. | mortgage | you | me | getting | a | purchase | assist | can | and | i | payment. | getting | i | in
my transfer failed why?,failed_transfer _ my | transfer
i tried to transfer money but it didn't go through,failed_transfer _ go | tried | to | didn't | transfer | but | i
is it okay to hold money in multiple currencies?,fiat_currency_support _ multiple | it | okay | in | to | currencies?
what are eligible holding and exchange currencies?,fiat_currency_support _ what | holding | exchange | are
what currencies can my account be in?,fiat_currency_support _ my | what | account | be
what currencies do you support?,fiat_currency_support _ support? | do | what
what fiat currencies are supported?,fiat_currency_support _ currencies | supported? | fiat
please can i get a disposable virtual card as well?,get_disposable_virtual_card _ a | i | can | well? | as | virtual | card
how do i get a disposable virtual card as well?,get_disposable_virtual_card _ how | virtual | get | disposable | do | as | a
where do i get a disposable card,get_disposable_virtual_card _ card | a | get | disposable
can you tell me about these disposable virtual cards?,get_disposable_virtual_card _ tell | can | these | disposable | virtual | cards?
what are the disposable cards used for?,get_disposable_virtual_card _ cards | for? | are | what
how do i set up my card pin?,get_physical_card _ do | how | set | my | card
